<?xml version="1.0" encoding="UTF-8" standalone="no"?>
<!DOCTYPE configuration SYSTEM "config.dtd">
<configuration>
    <matching>
        <minNumLines>3</minNumLines>
        <matchAlgorithm>0</matchAlgorithm>
        <gapSize>2</gapSize>
    </matching>
    <projects>
        <project>/Users/edmund/Documents/research/clocom/dbProjects/test1/</project>        
        <database>/Users/edmund/Documents/research/clocom/dbProjects/test2/</database>
        <loadDatabaseFilePaths>false</loadDatabaseFilePaths>
        <databaseFilePaths>/Users/edmund/Documents/research/clocom/fileList.obj</databaseFilePaths>
        <buildDatabase>true</buildDatabase>
        <buildTFIDF>false</buildTFIDF>
        <loadTFIDF>false</loadTFIDF>
    </projects>
    <outputSettings>
        <debug>false</debug>
        <removeEmpty>true</removeEmpty>
        <resultPath>/Users/edmund/Documents/research/comment-digger/results.txt</resultPath>
    </outputSettings>
    <loadResults>false</loadResults>
    <heuristics>
        <similarity>
            <similarityRange>extended</similarityRange>
            <enableSimilarity>true</enableSimilarity>
        </similarity>
    </heuristics>
</configuration>
